Air Delivered Effects (FA8651-22-S-0001),Munitions Directorate,https://www.grants.gov/search-results-detail/338821,03/21/2027,0.5,3.0,5.0,,,https://www.grants.gov/search-results-detail/338821,,,,Open 03/22/2022 → Close 03/21/2027,,,Status: posted
"DoD Military Burn, Technology/Therapeutic Development Award (HT942525MBRPTTDA)",Dept. of the Army -- USAMRAA,https://www.grants.gov/search-results-detail/358800,09/08/2025,0.5,3.0,2.0,,,https://www.grants.gov/search-results-detail/358800,,,,Open 05/01/2025 → Close 09/08/2025,,,Status: posted
Family Violence Prevention and Services Discretionary Grant Program/ National Indigenous Domestic Violence Hotline (HHS-2025-ACF-OFVPS-EV-0004),Administration for Children and Families - OFVPS,https://www.grants.gov/search-results-detail/355697,09/04/2025,0.5,3.0,1.0,,,https://www.grants.gov/search-results-detail/355697,,,,Open 08/20/2025 → Close 09/04/2025,,,Status: posted
Residential (Long Term Foster Care) Services for Unaccompanied Children (HHS-2023-ACF-ORR-ZU-0162),Administration for Children and Families - ORR,https://www.grants.gov/search-results-detail/340671,,0.5,3.0,4.0,,,https://www.grants.gov/search-results-detail/340671,,,,Open 05/25/2022 → Close ,,,Status: forecasted
Long Range Broad Agency Announcement (BAA) for NSWC Crane (N0016424SNB35),NSWC CRANE - N00164,https://www.grants.gov/search-results-detail/352238,,0.5,3.0,3.0,,,https://www.grants.gov/search-results-detail/352238,,,,Open 02/08/2024 → Close ,,,Status: posted
"DoD Military Burn, Patient-Centered Research Award (HT942525MBRPPCRA)",Dept. of the Army -- USAMRAA,https://www.grants.gov/search-results-detail/358799,09/08/2025,1.0,3.0,2.0,,,https://www.grants.gov/search-results-detail/358799,,,,Open 05/01/2025 → Close 09/08/2025,,,Status: posted
WATER RESOURCES RESEARCH ACT PROGRAM NATIONAL COMPETITIVE GRANTS FY2025 PROGRAM ANNOUNCEMENT For AQUATIC INVASIVE SPECIES (G25AS00483),Geological Survey,https://www.grants.gov/search-results-detail/360309,09/30/2025,1.0,3.0,2.0,,,https://www.grants.gov/search-results-detail/360309,,,,Open 08/15/2025 → Close 09/30/2025,,,Status: posted
Small Surface Water and Groundwater Storage Projects (Small Storage Program) (R25AS00270),Bureau of Reclamation,https://www.grants.gov/search-results-detail/360059,04/17/2026,0.5,3.0,5.0,,,https://www.grants.gov/search-results-detail/360059,,,,Open 07/17/2025 → Close 04/17/2026,,,Status: posted
Continuing Human Enabling Enhancing Restoring and Sustaining (FA238424S2233),Air Force -- Research Lab,https://www.grants.gov/search-results-detail/360258,08/22/2044,1.0,3.0,5.0,,,https://www.grants.gov/search-results-detail/360258,,,,Open 08/07/2025 → Close 08/22/2044,,,Status: posted
MAGNETIC ACCELERATION GENERATING NEW INNOVATIONS AND TACTICAL OUTCOMES SBIR/STTR (MAGNITO SBIR/STTR) (DE-FOA-0003591),Advanced Research Projects Agency Energy ,https://www.grants.gov/search-results-detail/360356,09/24/2025,3.0,4.0,2.0,,,https://www.grants.gov/search-results-detail/360356,,,,Open 08/25/2025 → Close 09/24/2025,,,Status: posted
Updated National Dislocated Worker Grant Program Guidance and Application Information (ETA-TEGL-09-24),Employment and Training Administration,https://www.grants.gov/search-results-detail/357771,12/31/2026,1.0,3.0,5.0,,,https://www.grants.gov/search-results-detail/357771,,,,Open 12/17/2024 → Close 12/31/2026,,,Status: posted
FY25 Naval Air Warfare Center Aircraft Division Office-Wide Broad Agency Announcement (N00421-25-S-0001),NAVAIR,https://www.grants.gov/search-results-detail/359802,06/22/2026,0.5,3.0,5.0,,,https://www.grants.gov/search-results-detail/359802,,,,Open 06/27/2025 → Close 06/22/2026,,,Status: posted
TTO Office Wide (OW) BAA 2025 (HR001125S0011),DARPA - Tactical Technology Office,https://www.grants.gov/search-results-detail/359782,12/22/2026,0.5,3.0,5.0,,,https://www.grants.gov/search-results-detail/359782,,,,Open 06/23/2025 → Close 12/22/2026,,,Status: posted
Defense Sciences Office (DSO) Office-wide BAA (HR001125S0013),DARPA - Defense Sciences Office,https://www.grants.gov/search-results-detail/359239,06/02/2026,0.5,3.0,5.0,0.0,,https://www.grants.gov/search-results-detail/359239,,,,Open 06/03/2025 → Close 06/02/2026,,,Status: posted
